<!-- 

     FILE: palette.dtd
  PURPOSE: Defines the CoastWatch palette structure in XML.
   AUTHOR: Peter Hollemans
     DATE: 2004/05/16

  CoastWatch Software Library and Utilities
  Copyright 2004, USDOC/NOAA/NESDIS CoastWatch

-->

<!ELEMENT palette (color*)>
<!ATTLIST palette name CDATA #REQUIRED>
<!ATTLIST palette length CDATA #REQUIRED>
<!ELEMENT color EMPTY>
<!ATTLIST color r CDATA #REQUIRED>
<!ATTLIST color g CDATA #REQUIRED>
<!ATTLIST color b CDATA #REQUIRED>
