<?xml version="1.0" encoding="ISO-8859-1"?>
<!DOCTYPE palette SYSTEM "http://coastwatch.noaa.gov/xml/palette.dtd">

<!-- This file was generated using data from the RSI IDL package v5.4 -->

<palette name="Steps" length="256">
  <color r="0" g="0" b="0" />
  <color r="0" g="42" b="0" />
  <color r="0" g="85" b="0" />
  <color r="0" g="127" b="0" />
  <color r="0" g="170" b="0" />
  <color r="0" g="212" b="0" />
  <color r="0" g="255" b="0" />
  <color r="0" g="246" b="0" />
  <color r="0" g="236" b="0" />
  <color r="0" g="226" b="0" />
  <color r="0" g="216" b="0" />
  <color r="0" g="206" b="0" />
  <color r="0" g="197" b="0" />
  <color r="0" g="187" b="0" />
  <color r="0" g="177" b="0" />
  <color r="0" g="167" b="0" />
  <color r="0" g="157" b="0" />
  <color r="0" g="148" b="0" />
  <color r="0" g="138" b="0" />
  <color r="0" g="128" b="0" />
  <color r="0" g="118" b="0" />
  <color r="0" g="108" b="0" />
  <color r="0" g="99" b="0" />
  <color r="0" g="89" b="0" />
  <color r="0" g="79" b="0" />
  <color r="0" g="69" b="0" />
  <color r="0" g="59" b="0" />
  <color r="0" g="50" b="0" />
  <color r="0" g="40" b="0" />
  <color r="0" g="30" b="0" />
  <color r="0" g="20" b="0" />
  <color r="0" g="10" b="0" />
  <color r="0" g="0" b="0" />
  <color r="0" g="0" b="8" />
  <color r="0" g="0" b="16" />
  <color r="0" g="0" b="24" />
  <color r="0" g="0" b="32" />
  <color r="0" g="0" b="41" />
  <color r="0" g="0" b="49" />
  <color r="0" g="0" b="57" />
  <color r="0" g="0" b="65" />
  <color r="0" g="0" b="74" />
  <color r="0" g="0" b="82" />
  <color r="0" g="0" b="90" />
  <color r="0" g="0" b="98" />
  <color r="0" g="0" b="106" />
  <color r="0" g="0" b="115" />
  <color r="0" g="0" b="123" />
  <color r="0" g="0" b="131" />
  <color r="0" g="0" b="139" />
  <color r="0" g="0" b="148" />
  <color r="0" g="0" b="156" />
  <color r="0" g="0" b="164" />
  <color r="0" g="0" b="172" />
  <color r="0" g="0" b="180" />
  <color r="0" g="0" b="189" />
  <color r="0" g="0" b="197" />
  <color r="0" g="0" b="205" />
  <color r="0" g="0" b="213" />
  <color r="0" g="0" b="222" />
  <color r="0" g="0" b="230" />
  <color r="0" g="0" b="238" />
  <color r="0" g="0" b="246" />
  <color r="0" g="0" b="255" />
  <color r="0" g="0" b="0" />
  <color r="7" g="0" b="5" />
  <color r="15" g="0" b="10" />
  <color r="23" g="0" b="15" />
  <color r="31" g="0" b="21" />
  <color r="39" g="0" b="26" />
  <color r="47" g="0" b="31" />
  <color r="55" g="0" b="37" />
  <color r="63" g="0" b="42" />
  <color r="70" g="0" b="47" />
  <color r="78" g="0" b="53" />
  <color r="86" g="0" b="58" />
  <color r="94" g="0" b="63" />
  <color r="102" g="0" b="69" />
  <color r="110" g="0" b="74" />
  <color r="118" g="0" b="79" />
  <color r="126" g="0" b="85" />
  <color r="134" g="0" b="89" />
  <color r="142" g="0" b="94" />
  <color r="151" g="0" b="98" />
  <color r="159" g="0" b="103" />
  <color r="168" g="0" b="108" />
  <color r="176" g="0" b="112" />
  <color r="184" g="0" b="117" />
  <color r="193" g="0" b="121" />
  <color r="201" g="0" b="126" />
  <color r="210" g="0" b="131" />
  <color r="218" g="0" b="135" />
  <color r="226" g="0" b="140" />
  <color r="235" g="0" b="144" />
  <color r="243" g="0" b="149" />
  <color r="252" g="0" b="154" />
  <color r="0" g="0" b="0" />
  <color r="1" g="0" b="0" />
  <color r="2" g="0" b="0" />
  <color r="3" g="0" b="0" />
  <color r="4" g="0" b="0" />
  <color r="5" g="0" b="0" />
  <color r="6" g="0" b="0" />
  <color r="7" g="0" b="0" />
  <color r="8" g="0" b="0" />
  <color r="9" g="0" b="0" />
  <color r="10" g="0" b="0" />
  <color r="11" g="0" b="0" />
  <color r="12" g="0" b="0" />
  <color r="14" g="0" b="0" />
  <color r="16" g="0" b="0" />
  <color r="18" g="0" b="0" />
  <color r="20" g="0" b="0" />
  <color r="23" g="0" b="0" />
  <color r="25" g="0" b="0" />
  <color r="27" g="0" b="0" />
  <color r="29" g="0" b="0" />
  <color r="32" g="0" b="0" />
  <color r="34" g="0" b="0" />
  <color r="36" g="0" b="0" />
  <color r="38" g="0" b="0" />
  <color r="41" g="0" b="0" />
  <color r="44" g="0" b="0" />
  <color r="47" g="0" b="0" />
  <color r="50" g="0" b="0" />
  <color r="53" g="0" b="0" />
  <color r="56" g="0" b="0" />
  <color r="59" g="0" b="0" />
  <color r="63" g="0" b="0" />
  <color r="66" g="0" b="0" />
  <color r="69" g="0" b="0" />
  <color r="72" g="0" b="0" />
  <color r="75" g="0" b="0" />
  <color r="78" g="0" b="0" />
  <color r="82" g="0" b="1" />
  <color r="85" g="0" b="1" />
  <color r="89" g="0" b="1" />
  <color r="93" g="0" b="1" />
  <color r="97" g="0" b="1" />
  <color r="101" g="0" b="1" />
  <color r="105" g="0" b="1" />
  <color r="108" g="0" b="1" />
  <color r="112" g="0" b="1" />
  <color r="116" g="0" b="1" />
  <color r="120" g="0" b="1" />
  <color r="124" g="0" b="1" />
  <color r="128" g="1" b="1" />
  <color r="131" g="1" b="1" />
  <color r="135" g="1" b="1" />
  <color r="139" g="1" b="1" />
  <color r="143" g="1" b="1" />
  <color r="147" g="1" b="1" />
  <color r="151" g="1" b="1" />
  <color r="155" g="1" b="1" />
  <color r="159" g="1" b="1" />
  <color r="163" g="1" b="1" />
  <color r="167" g="1" b="1" />
  <color r="171" g="1" b="1" />
  <color r="175" g="1" b="1" />
  <color r="178" g="1" b="1" />
  <color r="181" g="1" b="1" />
  <color r="185" g="1" b="1" />
  <color r="188" g="1" b="1" />
  <color r="192" g="1" b="1" />
  <color r="195" g="1" b="1" />
  <color r="198" g="1" b="1" />
  <color r="202" g="1" b="1" />
  <color r="205" g="1" b="1" />
  <color r="209" g="1" b="1" />
  <color r="212" g="1" b="1" />
  <color r="216" g="1" b="2" />
  <color r="218" g="1" b="2" />
  <color r="220" g="1" b="2" />
  <color r="223" g="1" b="2" />
  <color r="225" g="1" b="2" />
  <color r="227" g="1" b="2" />
  <color r="230" g="1" b="2" />
  <color r="232" g="1" b="2" />
  <color r="234" g="1" b="2" />
  <color r="237" g="1" b="2" />
  <color r="239" g="1" b="2" />
  <color r="241" g="1" b="2" />
  <color r="244" g="2" b="2" />
  <color r="244" g="2" b="2" />
  <color r="245" g="2" b="2" />
  <color r="246" g="2" b="2" />
  <color r="247" g="2" b="2" />
  <color r="247" g="2" b="2" />
  <color r="248" g="2" b="2" />
  <color r="249" g="2" b="2" />
  <color r="250" g="2" b="2" />
  <color r="250" g="2" b="2" />
  <color r="251" g="2" b="2" />
  <color r="252" g="2" b="2" />
  <color r="253" g="2" b="2" />
  <color r="254" g="1" b="2" />
  <color r="254" g="1" b="2" />
  <color r="254" g="3" b="2" />
  <color r="254" g="5" b="2" />
  <color r="254" g="8" b="2" />
  <color r="254" g="10" b="2" />
  <color r="254" g="12" b="2" />
  <color r="254" g="15" b="2" />
  <color r="254" g="17" b="2" />
  <color r="254" g="19" b="2" />
  <color r="254" g="22" b="2" />
  <color r="254" g="24" b="2" />
  <color r="254" g="26" b="2" />
  <color r="254" g="29" b="2" />
  <color r="254" g="31" b="2" />
  <color r="254" g="33" b="2" />
  <color r="254" g="36" b="2" />
  <color r="254" g="36" b="2" />
  <color r="254" g="38" b="3" />
  <color r="254" g="40" b="4" />
  <color r="254" g="42" b="5" />
  <color r="255" g="45" b="7" />
  <color r="255" g="48" b="9" />
  <color r="255" g="51" b="12" />
  <color r="255" g="54" b="14" />
  <color r="255" g="58" b="17" />
  <color r="255" g="61" b="20" />
  <color r="255" g="64" b="23" />
  <color r="255" g="67" b="27" />
  <color r="255" g="70" b="30" />
  <color r="255" g="73" b="34" />
  <color r="255" g="77" b="39" />
  <color r="255" g="82" b="44" />
  <color r="255" g="87" b="49" />
  <color r="255" g="92" b="55" />
  <color r="255" g="96" b="60" />
  <color r="255" g="100" b="65" />
  <color r="255" g="104" b="71" />
  <color r="255" g="108" b="76" />
  <color r="255" g="113" b="82" />
  <color r="255" g="119" b="89" />
  <color r="255" g="125" b="97" />
  <color r="255" g="131" b="104" />
  <color r="255" g="138" b="112" />
  <color r="255" g="144" b="120" />
  <color r="255" g="151" b="128" />
  <color r="255" g="157" b="136" />
  <color r="255" g="164" b="145" />
  <color r="255" g="171" b="153" />
  <color r="255" g="178" b="162" />
  <color r="255" g="185" b="171" />
  <color r="255" g="193" b="180" />
  <color r="255" g="200" b="189" />
  <color r="255" g="208" b="198" />
  <color r="255" g="215" b="207" />
  <color r="255" g="223" b="217" />
  <color r="255" g="229" b="224" />
  <color r="255" g="235" b="232" />
  <color r="255" g="242" b="239" />
  <color r="255" g="248" b="247" />
  <color r="255" g="255" b="255" />
</palette>
