<?xml version="1.0" encoding="ISO-8859-1"?>
<!DOCTYPE palette SYSTEM "http://coastwatch.noaa.gov/xml/palette.dtd">

<!-- This file was generated using data from the RSI IDL package v5.4 -->

<palette name="Red-Temperature" length="256">
  <color r="0" g="0" b="0" />
  <color r="1" g="0" b="0" />
  <color r="2" g="0" b="0" />
  <color r="4" g="0" b="0" />
  <color r="5" g="0" b="0" />
  <color r="7" g="0" b="0" />
  <color r="8" g="0" b="0" />
  <color r="10" g="0" b="0" />
  <color r="11" g="0" b="0" />
  <color r="13" g="0" b="0" />
  <color r="14" g="0" b="0" />
  <color r="15" g="0" b="0" />
  <color r="17" g="0" b="0" />
  <color r="18" g="0" b="0" />
  <color r="20" g="0" b="0" />
  <color r="21" g="0" b="0" />
  <color r="23" g="0" b="0" />
  <color r="24" g="0" b="0" />
  <color r="26" g="0" b="0" />
  <color r="27" g="0" b="0" />
  <color r="28" g="0" b="0" />
  <color r="30" g="0" b="0" />
  <color r="31" g="0" b="0" />
  <color r="33" g="0" b="0" />
  <color r="34" g="0" b="0" />
  <color r="36" g="0" b="0" />
  <color r="37" g="0" b="0" />
  <color r="39" g="0" b="0" />
  <color r="40" g="0" b="0" />
  <color r="42" g="0" b="0" />
  <color r="43" g="0" b="0" />
  <color r="44" g="0" b="0" />
  <color r="46" g="0" b="0" />
  <color r="47" g="0" b="0" />
  <color r="49" g="0" b="0" />
  <color r="50" g="0" b="0" />
  <color r="52" g="0" b="0" />
  <color r="53" g="0" b="0" />
  <color r="55" g="0" b="0" />
  <color r="56" g="0" b="0" />
  <color r="57" g="0" b="0" />
  <color r="59" g="0" b="0" />
  <color r="60" g="0" b="0" />
  <color r="62" g="0" b="0" />
  <color r="63" g="0" b="0" />
  <color r="65" g="0" b="0" />
  <color r="66" g="0" b="0" />
  <color r="68" g="0" b="0" />
  <color r="69" g="0" b="0" />
  <color r="70" g="0" b="0" />
  <color r="72" g="0" b="0" />
  <color r="73" g="0" b="0" />
  <color r="75" g="0" b="0" />
  <color r="76" g="0" b="0" />
  <color r="78" g="0" b="0" />
  <color r="79" g="0" b="0" />
  <color r="81" g="0" b="0" />
  <color r="82" g="0" b="0" />
  <color r="84" g="0" b="0" />
  <color r="85" g="0" b="0" />
  <color r="86" g="0" b="0" />
  <color r="88" g="0" b="0" />
  <color r="89" g="0" b="0" />
  <color r="91" g="0" b="0" />
  <color r="92" g="0" b="0" />
  <color r="94" g="0" b="0" />
  <color r="95" g="0" b="0" />
  <color r="97" g="0" b="0" />
  <color r="98" g="0" b="0" />
  <color r="99" g="0" b="0" />
  <color r="101" g="0" b="0" />
  <color r="102" g="0" b="0" />
  <color r="104" g="0" b="0" />
  <color r="105" g="0" b="0" />
  <color r="107" g="0" b="0" />
  <color r="108" g="0" b="0" />
  <color r="110" g="0" b="0" />
  <color r="111" g="0" b="0" />
  <color r="113" g="0" b="0" />
  <color r="114" g="0" b="0" />
  <color r="115" g="0" b="0" />
  <color r="117" g="0" b="0" />
  <color r="118" g="0" b="0" />
  <color r="120" g="0" b="0" />
  <color r="121" g="0" b="0" />
  <color r="123" g="0" b="0" />
  <color r="124" g="0" b="0" />
  <color r="126" g="0" b="0" />
  <color r="127" g="0" b="0" />
  <color r="128" g="0" b="0" />
  <color r="130" g="0" b="0" />
  <color r="131" g="0" b="0" />
  <color r="133" g="0" b="0" />
  <color r="134" g="0" b="0" />
  <color r="136" g="0" b="0" />
  <color r="137" g="0" b="0" />
  <color r="139" g="0" b="0" />
  <color r="140" g="0" b="0" />
  <color r="141" g="0" b="0" />
  <color r="143" g="0" b="0" />
  <color r="144" g="0" b="0" />
  <color r="146" g="0" b="0" />
  <color r="147" g="0" b="0" />
  <color r="149" g="0" b="0" />
  <color r="150" g="0" b="0" />
  <color r="152" g="0" b="0" />
  <color r="153" g="0" b="0" />
  <color r="155" g="0" b="0" />
  <color r="156" g="0" b="0" />
  <color r="157" g="0" b="0" />
  <color r="159" g="0" b="0" />
  <color r="160" g="0" b="0" />
  <color r="162" g="0" b="0" />
  <color r="163" g="0" b="0" />
  <color r="165" g="0" b="0" />
  <color r="166" g="0" b="0" />
  <color r="168" g="0" b="0" />
  <color r="169" g="0" b="0" />
  <color r="170" g="0" b="0" />
  <color r="172" g="0" b="0" />
  <color r="173" g="0" b="0" />
  <color r="175" g="1" b="0" />
  <color r="176" g="3" b="0" />
  <color r="178" g="5" b="0" />
  <color r="179" g="7" b="0" />
  <color r="181" g="9" b="0" />
  <color r="182" g="11" b="0" />
  <color r="184" g="13" b="0" />
  <color r="185" g="15" b="0" />
  <color r="186" g="17" b="0" />
  <color r="188" g="18" b="0" />
  <color r="189" g="20" b="0" />
  <color r="191" g="22" b="0" />
  <color r="192" g="24" b="0" />
  <color r="194" g="26" b="0" />
  <color r="195" g="28" b="0" />
  <color r="197" g="30" b="0" />
  <color r="198" g="32" b="0" />
  <color r="199" g="34" b="0" />
  <color r="201" g="35" b="0" />
  <color r="202" g="37" b="0" />
  <color r="204" g="39" b="0" />
  <color r="205" g="41" b="0" />
  <color r="207" g="43" b="0" />
  <color r="208" g="45" b="0" />
  <color r="210" g="47" b="0" />
  <color r="211" g="49" b="0" />
  <color r="212" g="51" b="0" />
  <color r="214" g="52" b="0" />
  <color r="215" g="54" b="0" />
  <color r="217" g="56" b="0" />
  <color r="218" g="58" b="0" />
  <color r="220" g="60" b="0" />
  <color r="221" g="62" b="0" />
  <color r="223" g="64" b="0" />
  <color r="224" g="66" b="0" />
  <color r="226" g="68" b="0" />
  <color r="227" g="69" b="0" />
  <color r="228" g="71" b="0" />
  <color r="230" g="73" b="0" />
  <color r="231" g="75" b="0" />
  <color r="233" g="77" b="0" />
  <color r="234" g="79" b="0" />
  <color r="236" g="81" b="0" />
  <color r="237" g="83" b="0" />
  <color r="239" g="85" b="0" />
  <color r="240" g="86" b="0" />
  <color r="241" g="88" b="0" />
  <color r="243" g="90" b="0" />
  <color r="244" g="92" b="0" />
  <color r="246" g="94" b="0" />
  <color r="247" g="96" b="0" />
  <color r="249" g="98" b="0" />
  <color r="250" g="100" b="0" />
  <color r="252" g="102" b="0" />
  <color r="253" g="103" b="0" />
  <color r="255" g="105" b="0" />
  <color r="255" g="107" b="0" />
  <color r="255" g="109" b="0" />
  <color r="255" g="111" b="0" />
  <color r="255" g="113" b="0" />
  <color r="255" g="115" b="0" />
  <color r="255" g="117" b="0" />
  <color r="255" g="119" b="0" />
  <color r="255" g="120" b="0" />
  <color r="255" g="122" b="0" />
  <color r="255" g="124" b="0" />
  <color r="255" g="126" b="0" />
  <color r="255" g="128" b="0" />
  <color r="255" g="130" b="0" />
  <color r="255" g="132" b="0" />
  <color r="255" g="134" b="3" />
  <color r="255" g="136" b="7" />
  <color r="255" g="137" b="11" />
  <color r="255" g="139" b="15" />
  <color r="255" g="141" b="19" />
  <color r="255" g="143" b="23" />
  <color r="255" g="145" b="27" />
  <color r="255" g="147" b="31" />
  <color r="255" g="149" b="35" />
  <color r="255" g="151" b="39" />
  <color r="255" g="153" b="43" />
  <color r="255" g="154" b="47" />
  <color r="255" g="156" b="51" />
  <color r="255" g="158" b="54" />
  <color r="255" g="160" b="58" />
  <color r="255" g="162" b="62" />
  <color r="255" g="164" b="66" />
  <color r="255" g="166" b="70" />
  <color r="255" g="168" b="74" />
  <color r="255" g="170" b="78" />
  <color r="255" g="171" b="82" />
  <color r="255" g="173" b="86" />
  <color r="255" g="175" b="90" />
  <color r="255" g="177" b="94" />
  <color r="255" g="179" b="98" />
  <color r="255" g="181" b="102" />
  <color r="255" g="183" b="105" />
  <color r="255" g="185" b="109" />
  <color r="255" g="187" b="113" />
  <color r="255" g="188" b="117" />
  <color r="255" g="190" b="121" />
  <color r="255" g="192" b="125" />
  <color r="255" g="194" b="129" />
  <color r="255" g="196" b="133" />
  <color r="255" g="198" b="137" />
  <color r="255" g="200" b="141" />
  <color r="255" g="202" b="145" />
  <color r="255" g="204" b="149" />
  <color r="255" g="205" b="153" />
  <color r="255" g="207" b="156" />
  <color r="255" g="209" b="160" />
  <color r="255" g="211" b="164" />
  <color r="255" g="213" b="168" />
  <color r="255" g="215" b="172" />
  <color r="255" g="217" b="176" />
  <color r="255" g="219" b="180" />
  <color r="255" g="221" b="184" />
  <color r="255" g="222" b="188" />
  <color r="255" g="224" b="192" />
  <color r="255" g="226" b="196" />
  <color r="255" g="228" b="200" />
  <color r="255" g="230" b="204" />
  <color r="255" g="232" b="207" />
  <color r="255" g="234" b="211" />
  <color r="255" g="236" b="215" />
  <color r="255" g="238" b="219" />
  <color r="255" g="239" b="223" />
  <color r="255" g="241" b="227" />
  <color r="255" g="243" b="231" />
  <color r="255" g="245" b="235" />
  <color r="255" g="247" b="239" />
  <color r="255" g="249" b="243" />
  <color r="255" g="251" b="247" />
  <color r="255" g="253" b="251" />
  <color r="255" g="255" b="255" />
</palette>
