<?xml version="1.0" encoding="ISO-8859-1"?>
<!DOCTYPE palette SYSTEM "http://coastwatch.noaa.gov/xml/palette.dtd">
<palette name="Chlora-1" length="101">
  <color r="132" g="0" b="124" />
  <color r="132" g="0" b="124" />
  <color r="124" g="0" b="131" />
  <color r="117" g="0" b="138" />
  <color r="110" g="0" b="145" />
  <color r="102" g="0" b="153" />
  <color r="95" g="0" b="160" />
  <color r="88" g="0" b="167" />
  <color r="80" g="0" b="174" />
  <color r="73" g="0" b="182" />
  <color r="66" g="0" b="189" />
  <color r="58" g="0" b="196" />
  <color r="51" g="0" b="204" />
  <color r="44" g="0" b="211" />
  <color r="36" g="0" b="218" />
  <color r="29" g="0" b="225" />
  <color r="22" g="0" b="233" />
  <color r="14" g="0" b="240" />
  <color r="7" g="0" b="247" />
  <color r="0" g="0" b="255" />
  <color r="0" g="14" b="255" />
  <color r="0" g="28" b="255" />
  <color r="0" g="42" b="255" />
  <color r="0" g="56" b="255" />
  <color r="0" g="70" b="255" />
  <color r="0" g="85" b="255" />
  <color r="0" g="99" b="255" />
  <color r="0" g="113" b="255" />
  <color r="0" g="127" b="255" />
  <color r="0" g="141" b="255" />
  <color r="0" g="155" b="255" />
  <color r="0" g="170" b="255" />
  <color r="0" g="184" b="255" />
  <color r="0" g="198" b="255" />
  <color r="0" g="212" b="255" />
  <color r="0" g="226" b="255" />
  <color r="0" g="240" b="255" />
  <color r="0" g="255" b="255" />
  <color r="0" g="255" b="231" />
  <color r="0" g="255" b="208" />
  <color r="0" g="255" b="185" />
  <color r="0" g="255" b="162" />
  <color r="0" g="255" b="139" />
  <color r="0" g="255" b="115" />
  <color r="0" g="255" b="92" />
  <color r="0" g="255" b="69" />
  <color r="0" g="255" b="46" />
  <color r="0" g="255" b="23" />
  <color r="0" g="255" b="0" />
  <color r="0" g="255" b="0" />
  <color r="21" g="255" b="0" />
  <color r="42" g="255" b="0" />
  <color r="63" g="255" b="0" />
  <color r="85" g="255" b="0" />
  <color r="106" g="255" b="0" />
  <color r="127" g="255" b="0" />
  <color r="148" g="255" b="0" />
  <color r="170" g="255" b="0" />
  <color r="191" g="255" b="0" />
  <color r="212" g="255" b="0" />
  <color r="233" g="255" b="0" />
  <color r="255" g="255" b="0" />
  <color r="255" g="244" b="0" />
  <color r="255" g="233" b="0" />
  <color r="255" g="223" b="0" />
  <color r="255" g="212" b="0" />
  <color r="255" g="201" b="0" />
  <color r="255" g="191" b="0" />
  <color r="255" g="180" b="0" />
  <color r="255" g="170" b="0" />
  <color r="255" g="159" b="0" />
  <color r="255" g="148" b="0" />
  <color r="255" g="138" b="0" />
  <color r="255" g="127" b="0" />
  <color r="255" g="116" b="0" />
  <color r="255" g="106" b="0" />
  <color r="255" g="95" b="0" />
  <color r="255" g="85" b="0" />
  <color r="255" g="74" b="0" />
  <color r="255" g="63" b="0" />
  <color r="255" g="53" b="0" />
  <color r="255" g="42" b="0" />
  <color r="255" g="31" b="0" />
  <color r="255" g="21" b="0" />
  <color r="255" g="10" b="0" />
  <color r="255" g="0" b="0" />
  <color r="247" g="0" b="0" />
  <color r="240" g="0" b="0" />
  <color r="232" g="0" b="0" />
  <color r="225" g="0" b="0" />
  <color r="217" g="0" b="0" />
  <color r="210" g="0" b="0" />
  <color r="202" g="0" b="0" />
  <color r="195" g="0" b="0" />
  <color r="187" g="0" b="0" />
  <color r="180" g="0" b="0" />
  <color r="180" g="100" b="100" />
  <color r="180" g="100" b="100" />
  <color r="180" g="100" b="100" />
  <color r="180" g="100" b="100" />
  <color r="180" g="100" b="100" />
</palette>
