<?xml version="1.0" encoding="ISO-8859-1"?>
<!DOCTYPE palette SYSTEM "http://coastwatch.noaa.gov/xml/palette.dtd">
<palette name="Coral-Reef-Hotspot" length="50">

<!-- Less than 0 -->
<!-- <color r="200" g="250" b="250" /> -->

<!-- 0 to 1 -->

<color r="110" g="80" b="255" />
<color r="115" g="85" b="255" />
<color r="120" g="90" b="255" />
<color r="125" g="95" b="255" />
<color r="130" g="100" b="255" />

<color r="150" g="120" b="255" />
<color r="155" g="125" b="255" />
<color r="160" g="130" b="255" />
<color r="165" g="135" b="255" />
<color r="170" g="140" b="255" />

<!-- 1 to 2 -->

<color r="237" g="255" b="0" />
<color r="239" g="247" b="0" />
<color r="241" g="239" b="0" />
<color r="243" g="231" b="0" />
<color r="245" g="223" b="0" />

<color r="247" g="197" b="0" />
<color r="249" g="189" b="0" />
<color r="251" g="181" b="0" />
<color r="253" g="173" b="0" />
<color r="255" g="165" b="0" />

<!-- 2 to 3 -->

<color r="255" g="135" b="0" />
<color r="253" g="130" b="0" />
<color r="251" g="125" b="0" />
<color r="249" g="120" b="0" />
<color r="247" g="115" b="0" />

<color r="245" g="95" b="0" />
<color r="243" g="90" b="0" />
<color r="241" g="85" b="0" />
<color r="239" g="80" b="0" />
<color r="237" g="75" b="0" />

<!-- 3 to 4 -->

<color r="255" g="50" b="0" />
<color r="250" g="45" b="0" />
<color r="245" g="40" b="0" />
<color r="240" g="35" b="0" />
<color r="235" g="30" b="0" />

<color r="220" g="20" b="0" />
<color r="215" g="15" b="0" />
<color r="210" g="10" b="0" />
<color r="205" g="5" b="0" />
<color r="200" g="0" b="0" />

<!-- 4 to 5 -->

<color r="170" g="36" b="0" />
<color r="165" g="32" b="0" />
<color r="160" g="28" b="0" />
<color r="155" g="24" b="0" />
<color r="150" g="20" b="0" />

<color r="130" g="16" b="0" />
<color r="125" g="12" b="0" />
<color r="120" g="8" b="0" />
<color r="115" g="4" b="0" />
<color r="110" g="0" b="0" />

<!-- Greater than 5 -->
<!-- <color r="115" g="4" b="0" /> -->

</palette>
