<?xml version="1.0" encoding="ISO-8859-1"?>
<!DOCTYPE palette SYSTEM "http://coastwatch.noaa.gov/xml/palette.dtd">

<!-- This file was generated using data from the RSI IDL package v5.4 -->

<palette name="Purple-Red-Stripes" length="256">
  <color r="0" g="0" b="0" />
  <color r="0" g="0" b="0" />
  <color r="127" g="127" b="127" />
  <color r="191" g="0" b="191" />
  <color r="188" g="0" b="192" />
  <color r="186" g="0" b="192" />
  <color r="184" g="0" b="193" />
  <color r="182" g="0" b="194" />
  <color r="179" g="0" b="195" />
  <color r="177" g="0" b="195" />
  <color r="140" g="0" b="157" />
  <color r="138" g="0" b="157" />
  <color r="170" g="0" b="198" />
  <color r="168" g="0" b="198" />
  <color r="165" g="0" b="199" />
  <color r="163" g="0" b="200" />
  <color r="161" g="0" b="201" />
  <color r="158" g="0" b="202" />
  <color r="156" g="0" b="202" />
  <color r="154" g="0" b="203" />
  <color r="121" g="0" b="163" />
  <color r="119" g="0" b="164" />
  <color r="147" g="0" b="205" />
  <color r="145" g="0" b="206" />
  <color r="142" g="0" b="207" />
  <color r="140" g="0" b="208" />
  <color r="138" g="0" b="208" />
  <color r="135" g="0" b="209" />
  <color r="133" g="0" b="210" />
  <color r="131" g="0" b="211" />
  <color r="103" g="0" b="169" />
  <color r="101" g="0" b="170" />
  <color r="124" g="0" b="213" />
  <color r="122" g="0" b="214" />
  <color r="119" g="0" b="215" />
  <color r="117" g="0" b="215" />
  <color r="115" g="0" b="216" />
  <color r="112" g="0" b="217" />
  <color r="110" g="0" b="218" />
  <color r="108" g="0" b="218" />
  <color r="84" g="0" b="175" />
  <color r="82" g="0" b="176" />
  <color r="101" g="0" b="221" />
  <color r="99" g="0" b="221" />
  <color r="96" g="0" b="222" />
  <color r="94" g="0" b="223" />
  <color r="92" g="0" b="224" />
  <color r="89" g="0" b="225" />
  <color r="87" g="0" b="225" />
  <color r="85" g="0" b="226" />
  <color r="66" g="0" b="181" />
  <color r="64" g="0" b="182" />
  <color r="78" g="0" b="228" />
  <color r="76" g="0" b="229" />
  <color r="73" g="0" b="230" />
  <color r="71" g="0" b="231" />
  <color r="69" g="0" b="231" />
  <color r="66" g="0" b="232" />
  <color r="64" g="0" b="233" />
  <color r="62" g="0" b="234" />
  <color r="47" g="0" b="188" />
  <color r="46" g="0" b="188" />
  <color r="55" g="0" b="236" />
  <color r="52" g="0" b="237" />
  <color r="50" g="0" b="238" />
  <color r="48" g="0" b="238" />
  <color r="46" g="0" b="239" />
  <color r="43" g="0" b="240" />
  <color r="41" g="0" b="241" />
  <color r="39" g="0" b="241" />
  <color r="29" g="0" b="194" />
  <color r="27" g="0" b="194" />
  <color r="32" g="0" b="244" />
  <color r="29" g="0" b="245" />
  <color r="27" g="0" b="245" />
  <color r="25" g="0" b="246" />
  <color r="23" g="0" b="247" />
  <color r="20" g="0" b="248" />
  <color r="18" g="0" b="248" />
  <color r="16" g="0" b="249" />
  <color r="11" g="0" b="200" />
  <color r="9" g="0" b="200" />
  <color r="9" g="0" b="251" />
  <color r="6" g="0" b="252" />
  <color r="4" g="0" b="253" />
  <color r="2" g="0" b="254" />
  <color r="0" g="0" b="255" />
  <color r="0" g="6" b="255" />
  <color r="0" g="12" b="255" />
  <color r="0" g="18" b="255" />
  <color r="0" g="19" b="204" />
  <color r="0" g="24" b="204" />
  <color r="0" g="36" b="255" />
  <color r="0" g="42" b="255" />
  <color r="0" g="48" b="255" />
  <color r="0" g="54" b="255" />
  <color r="0" g="60" b="255" />
  <color r="0" g="66" b="255" />
  <color r="0" g="72" b="255" />
  <color r="0" g="78" b="255" />
  <color r="0" g="68" b="204" />
  <color r="0" g="72" b="204" />
  <color r="0" g="97" b="255" />
  <color r="0" g="103" b="255" />
  <color r="0" g="109" b="255" />
  <color r="0" g="115" b="255" />
  <color r="0" g="121" b="255" />
  <color r="0" g="127" b="255" />
  <color r="0" g="133" b="255" />
  <color r="0" g="139" b="255" />
  <color r="0" g="116" b="204" />
  <color r="0" g="121" b="204" />
  <color r="0" g="157" b="255" />
  <color r="0" g="163" b="255" />
  <color r="0" g="170" b="255" />
  <color r="0" g="176" b="255" />
  <color r="0" g="182" b="255" />
  <color r="0" g="188" b="255" />
  <color r="0" g="194" b="255" />
  <color r="0" g="200" b="255" />
  <color r="0" g="165" b="204" />
  <color r="0" g="170" b="204" />
  <color r="0" g="218" b="255" />
  <color r="0" g="224" b="255" />
  <color r="0" g="230" b="255" />
  <color r="0" g="236" b="255" />
  <color r="0" g="242" b="255" />
  <color r="0" g="248" b="255" />
  <color r="0" g="255" b="255" />
  <color r="0" g="255" b="248" />
  <color r="0" g="204" b="194" />
  <color r="0" g="204" b="189" />
  <color r="0" g="255" b="230" />
  <color r="0" g="255" b="224" />
  <color r="0" g="255" b="218" />
  <color r="0" g="255" b="212" />
  <color r="0" g="255" b="206" />
  <color r="0" g="255" b="200" />
  <color r="0" g="255" b="194" />
  <color r="0" g="255" b="188" />
  <color r="0" g="204" b="145" />
  <color r="0" g="204" b="140" />
  <color r="0" g="255" b="169" />
  <color r="0" g="255" b="163" />
  <color r="0" g="255" b="157" />
  <color r="0" g="255" b="151" />
  <color r="0" g="255" b="145" />
  <color r="0" g="255" b="139" />
  <color r="0" g="255" b="133" />
  <color r="0" g="255" b="127" />
  <color r="0" g="204" b="97" />
  <color r="0" g="204" b="92" />
  <color r="0" g="255" b="109" />
  <color r="0" g="255" b="103" />
  <color r="0" g="255" b="97" />
  <color r="0" g="255" b="91" />
  <color r="0" g="255" b="84" />
  <color r="0" g="255" b="78" />
  <color r="0" g="255" b="72" />
  <color r="0" g="255" b="66" />
  <color r="0" g="204" b="48" />
  <color r="0" g="204" b="43" />
  <color r="0" g="255" b="48" />
  <color r="0" g="255" b="42" />
  <color r="0" g="255" b="36" />
  <color r="0" g="255" b="30" />
  <color r="0" g="255" b="24" />
  <color r="0" g="255" b="18" />
  <color r="0" g="255" b="12" />
  <color r="0" g="255" b="6" />
  <color r="0" g="204" b="0" />
  <color r="4" g="204" b="0" />
  <color r="12" g="255" b="0" />
  <color r="18" g="255" b="0" />
  <color r="24" g="255" b="0" />
  <color r="30" g="255" b="0" />
  <color r="36" g="255" b="0" />
  <color r="42" g="255" b="0" />
  <color r="48" g="255" b="0" />
  <color r="54" g="255" b="0" />
  <color r="48" g="204" b="0" />
  <color r="53" g="204" b="0" />
  <color r="72" g="255" b="0" />
  <color r="78" g="255" b="0" />
  <color r="85" g="255" b="0" />
  <color r="91" g="255" b="0" />
  <color r="97" g="255" b="0" />
  <color r="103" g="255" b="0" />
  <color r="109" g="255" b="0" />
  <color r="115" g="255" b="0" />
  <color r="97" g="204" b="0" />
  <color r="102" g="204" b="0" />
  <color r="133" g="255" b="0" />
  <color r="139" g="255" b="0" />
  <color r="145" g="255" b="0" />
  <color r="151" g="255" b="0" />
  <color r="157" g="255" b="0" />
  <color r="163" g="255" b="0" />
  <color r="170" g="255" b="0" />
  <color r="176" g="255" b="0" />
  <color r="145" g="204" b="0" />
  <color r="150" g="204" b="0" />
  <color r="194" g="255" b="0" />
  <color r="200" g="255" b="0" />
  <color r="206" g="255" b="0" />
  <color r="212" g="255" b="0" />
  <color r="218" g="255" b="0" />
  <color r="224" g="255" b="0" />
  <color r="230" g="255" b="0" />
  <color r="236" g="255" b="0" />
  <color r="194" g="204" b="0" />
  <color r="199" g="204" b="0" />
  <color r="255" g="255" b="0" />
  <color r="255" g="248" b="2" />
  <color r="255" g="242" b="5" />
  <color r="255" g="235" b="7" />
  <color r="255" g="229" b="10" />
  <color r="255" g="223" b="12" />
  <color r="255" g="216" b="15" />
  <color r="255" g="210" b="17" />
  <color r="204" g="163" b="16" />
  <color r="204" g="158" b="18" />
  <color r="255" g="191" b="25" />
  <color r="255" g="184" b="28" />
  <color r="255" g="178" b="30" />
  <color r="255" g="172" b="33" />
  <color r="255" g="165" b="35" />
  <color r="255" g="159" b="38" />
  <color r="255" g="153" b="40" />
  <color r="255" g="146" b="43" />
  <color r="204" g="112" b="36" />
  <color r="204" g="107" b="38" />
  <color r="255" g="127" b="51" />
  <color r="255" g="121" b="48" />
  <color r="255" g="115" b="46" />
  <color r="255" g="110" b="44" />
  <color r="255" g="104" b="41" />
  <color r="255" g="98" b="39" />
  <color r="255" g="92" b="37" />
  <color r="255" g="86" b="34" />
  <color r="204" g="64" b="25" />
  <color r="204" g="60" b="24" />
  <color r="255" g="69" b="27" />
  <color r="255" g="63" b="25" />
  <color r="255" g="57" b="23" />
  <color r="255" g="52" b="20" />
  <color r="255" g="46" b="18" />
  <color r="255" g="40" b="16" />
  <color r="255" g="34" b="13" />
  <color r="255" g="28" b="11" />
  <color r="204" g="18" b="7" />
  <color r="204" g="13" b="5" />
  <color r="255" g="11" b="4" />
  <color r="255" g="5" b="2" />
  <color r="255" g="0" b="0" />
  <color r="255" g="0" b="0" />
</palette>
