<?xml version="1.0" encoding="ISO-8859-1"?>
<!DOCTYPE palette SYSTEM "http://coastwatch.noaa.gov/xml/palette.dtd">

<!-- This file was generated using data from the RSI IDL package v5.4 -->

<palette name="Eos-A" length="256">
  <color r="0" g="0" b="0" />
  <color r="0" g="0" b="0" />
  <color r="127" g="127" b="127" />
  <color r="123" g="0" b="193" />
  <color r="119" g="0" b="195" />
  <color r="114" g="0" b="197" />
  <color r="110" g="0" b="199" />
  <color r="106" g="0" b="201" />
  <color r="102" g="0" b="204" />
  <color r="97" g="0" b="206" />
  <color r="84" g="0" b="187" />
  <color r="80" g="0" b="189" />
  <color r="76" g="0" b="191" />
  <color r="80" g="0" b="214" />
  <color r="76" g="0" b="216" />
  <color r="72" g="0" b="218" />
  <color r="67" g="0" b="221" />
  <color r="63" g="0" b="223" />
  <color r="59" g="0" b="225" />
  <color r="55" g="0" b="227" />
  <color r="45" g="0" b="206" />
  <color r="42" g="0" b="208" />
  <color r="38" g="0" b="210" />
  <color r="38" g="0" b="235" />
  <color r="33" g="0" b="238" />
  <color r="29" g="0" b="240" />
  <color r="25" g="0" b="242" />
  <color r="21" g="0" b="244" />
  <color r="16" g="0" b="246" />
  <color r="12" g="0" b="248" />
  <color r="7" g="0" b="225" />
  <color r="3" g="0" b="227" />
  <color r="0" g="0" b="229" />
  <color r="0" g="17" b="255" />
  <color r="0" g="34" b="255" />
  <color r="0" g="51" b="255" />
  <color r="0" g="68" b="255" />
  <color r="0" g="85" b="255" />
  <color r="0" g="102" b="255" />
  <color r="0" g="119" b="255" />
  <color r="0" g="122" b="229" />
  <color r="0" g="137" b="229" />
  <color r="0" g="153" b="229" />
  <color r="0" g="187" b="255" />
  <color r="0" g="204" b="255" />
  <color r="0" g="221" b="255" />
  <color r="0" g="238" b="255" />
  <color r="0" g="255" b="255" />
  <color r="0" g="255" b="238" />
  <color r="0" g="255" b="221" />
  <color r="0" g="229" b="183" />
  <color r="0" g="229" b="168" />
  <color r="0" g="229" b="152" />
  <color r="0" g="255" b="153" />
  <color r="0" g="255" b="135" />
  <color r="0" g="255" b="118" />
  <color r="0" g="255" b="101" />
  <color r="0" g="255" b="84" />
  <color r="0" g="255" b="67" />
  <color r="0" g="255" b="50" />
  <color r="0" g="229" b="30" />
  <color r="0" g="229" b="15" />
  <color r="0" g="229" b="0" />
  <color r="8" g="255" b="0" />
  <color r="17" g="255" b="0" />
  <color r="25" g="255" b="0" />
  <color r="34" g="255" b="0" />
  <color r="42" g="255" b="0" />
  <color r="51" g="255" b="0" />
  <color r="59" g="255" b="0" />
  <color r="61" g="229" b="0" />
  <color r="68" g="229" b="0" />
  <color r="76" g="229" b="0" />
  <color r="93" g="255" b="0" />
  <color r="102" g="255" b="0" />
  <color r="110" g="255" b="0" />
  <color r="119" g="255" b="0" />
  <color r="127" g="255" b="0" />
  <color r="136" g="255" b="0" />
  <color r="144" g="255" b="0" />
  <color r="137" g="229" b="0" />
  <color r="145" g="229" b="0" />
  <color r="153" g="229" b="0" />
  <color r="178" g="255" b="0" />
  <color r="187" g="255" b="0" />
  <color r="195" g="255" b="0" />
  <color r="204" g="255" b="0" />
  <color r="212" g="255" b="0" />
  <color r="221" g="255" b="0" />
  <color r="229" g="255" b="0" />
  <color r="214" g="229" b="0" />
  <color r="221" g="229" b="0" />
  <color r="229" g="229" b="0" />
  <color r="255" g="250" b="0" />
  <color r="255" g="246" b="0" />
  <color r="255" g="242" b="0" />
  <color r="255" g="238" b="0" />
  <color r="255" g="233" b="0" />
  <color r="255" g="229" b="0" />
  <color r="255" g="225" b="0" />
  <color r="229" g="198" b="0" />
  <color r="229" g="195" b="0" />
  <color r="229" g="191" b="0" />
  <color r="255" g="208" b="0" />
  <color r="255" g="204" b="0" />
  <color r="255" g="199" b="0" />
  <color r="255" g="195" b="0" />
  <color r="255" g="191" b="0" />
  <color r="255" g="187" b="0" />
  <color r="255" g="182" b="0" />
  <color r="229" g="160" b="0" />
  <color r="229" g="156" b="0" />
  <color r="229" g="152" b="0" />
  <color r="255" g="165" b="0" />
  <color r="255" g="161" b="0" />
  <color r="255" g="157" b="0" />
  <color r="255" g="153" b="0" />
  <color r="255" g="148" b="0" />
  <color r="255" g="144" b="0" />
  <color r="255" g="140" b="0" />
  <color r="229" g="122" b="0" />
  <color r="229" g="118" b="0" />
  <color r="229" g="114" b="0" />
  <color r="255" g="125" b="0" />
  <color r="255" g="123" b="0" />
  <color r="255" g="121" b="0" />
  <color r="255" g="119" b="0" />
  <color r="255" g="116" b="0" />
  <color r="255" g="114" b="0" />
  <color r="255" g="112" b="0" />
  <color r="229" g="99" b="0" />
  <color r="229" g="97" b="0" />
  <color r="229" g="95" b="0" />
  <color r="255" g="104" b="0" />
  <color r="255" g="102" b="0" />
  <color r="255" g="99" b="0" />
  <color r="255" g="97" b="0" />
  <color r="255" g="95" b="0" />
  <color r="255" g="93" b="0" />
  <color r="255" g="91" b="0" />
  <color r="229" g="80" b="0" />
  <color r="229" g="78" b="0" />
  <color r="229" g="76" b="0" />
  <color r="255" g="82" b="0" />
  <color r="255" g="80" b="0" />
  <color r="255" g="78" b="0" />
  <color r="255" g="76" b="0" />
  <color r="255" g="74" b="0" />
  <color r="255" g="72" b="0" />
  <color r="255" g="70" b="0" />
  <color r="229" g="61" b="0" />
  <color r="229" g="59" b="0" />
  <color r="229" g="57" b="0" />
  <color r="255" g="61" b="0" />
  <color r="255" g="59" b="0" />
  <color r="255" g="57" b="0" />
  <color r="255" g="55" b="0" />
  <color r="255" g="53" b="0" />
  <color r="255" g="50" b="0" />
  <color r="255" g="48" b="0" />
  <color r="229" g="42" b="0" />
  <color r="229" g="40" b="0" />
  <color r="229" g="38" b="0" />
  <color r="255" g="40" b="0" />
  <color r="255" g="38" b="0" />
  <color r="255" g="36" b="0" />
  <color r="255" g="33" b="0" />
  <color r="255" g="31" b="0" />
  <color r="255" g="29" b="0" />
  <color r="255" g="27" b="0" />
  <color r="229" g="22" b="0" />
  <color r="229" g="21" b="0" />
  <color r="229" g="19" b="0" />
  <color r="255" g="19" b="0" />
  <color r="255" g="16" b="0" />
  <color r="255" g="14" b="0" />
  <color r="255" g="12" b="0" />
  <color r="255" g="13" b="0" />
  <color r="255" g="8" b="0" />
  <color r="255" g="6" b="0" />
  <color r="229" g="3" b="0" />
  <color r="229" g="1" b="0" />
  <color r="229" g="0" b="0" />
  <color r="253" g="0" b="0" />
  <color r="251" g="0" b="0" />
  <color r="249" g="0" b="0" />
  <color r="248" g="0" b="0" />
  <color r="246" g="0" b="0" />
  <color r="244" g="0" b="0" />
  <color r="242" g="0" b="0" />
  <color r="217" g="0" b="0" />
  <color r="215" g="0" b="0" />
  <color r="213" g="0" b="0" />
  <color r="236" g="0" b="0" />
  <color r="234" g="0" b="0" />
  <color r="232" g="0" b="0" />
  <color r="230" g="0" b="0" />
  <color r="229" g="0" b="0" />
  <color r="227" g="0" b="0" />
  <color r="225" g="0" b="0" />
  <color r="201" g="0" b="0" />
  <color r="200" g="0" b="0" />
  <color r="198" g="0" b="0" />
  <color r="218" g="0" b="0" />
  <color r="217" g="0" b="0" />
  <color r="215" g="0" b="0" />
  <color r="213" g="0" b="0" />
  <color r="211" g="0" b="0" />
  <color r="210" g="0" b="0" />
  <color r="208" g="0" b="0" />
  <color r="186" g="0" b="0" />
  <color r="184" g="0" b="0" />
  <color r="182" g="0" b="0" />
  <color r="201" g="0" b="0" />
  <color r="199" g="0" b="0" />
  <color r="198" g="0" b="0" />
  <color r="196" g="0" b="0" />
  <color r="194" g="0" b="0" />
  <color r="192" g="0" b="0" />
  <color r="191" g="0" b="0" />
  <color r="170" g="0" b="0" />
  <color r="169" g="0" b="0" />
  <color r="167" g="0" b="0" />
  <color r="184" g="0" b="0" />
  <color r="182" g="0" b="0" />
  <color r="180" g="0" b="0" />
  <color r="179" g="0" b="0" />
  <color r="177" g="0" b="0" />
  <color r="175" g="0" b="0" />
  <color r="174" g="0" b="0" />
  <color r="155" g="0" b="0" />
  <color r="153" g="0" b="0" />
  <color r="151" g="0" b="0" />
  <color r="167" g="0" b="0" />
  <color r="165" g="0" b="0" />
  <color r="163" g="0" b="0" />
  <color r="161" g="0" b="0" />
  <color r="160" g="0" b="0" />
  <color r="158" g="0" b="0" />
  <color r="156" g="0" b="0" />
  <color r="139" g="0" b="0" />
  <color r="138" g="0" b="0" />
  <color r="136" g="0" b="0" />
  <color r="149" g="0" b="0" />
  <color r="148" g="0" b="0" />
  <color r="146" g="0" b="0" />
  <color r="144" g="0" b="0" />
  <color r="143" g="0" b="0" />
  <color r="141" g="0" b="0" />
  <color r="139" g="0" b="0" />
  <color r="124" g="0" b="0" />
  <color r="122" g="0" b="0" />
  <color r="120" g="0" b="0" />
  <color r="132" g="0" b="0" />
  <color r="130" g="0" b="0" />
  <color r="130" g="0" b="0" />
</palette>
