<?xml version="1.0" encoding="ISO-8859-1"?>
<!DOCTYPE palette SYSTEM "http://coastwatch.noaa.gov/xml/palette.dtd">

<!-- This file was generated using data from the RSI IDL package v5.4 -->

<palette name="Blue-Green-Red-Yellow" length="256">
  <color r="0" g="0" b="0" />
  <color r="0" g="0" b="2" />
  <color r="0" g="0" b="4" />
  <color r="0" g="0" b="6" />
  <color r="0" g="0" b="8" />
  <color r="0" g="0" b="10" />
  <color r="0" g="0" b="12" />
  <color r="0" g="0" b="14" />
  <color r="0" g="0" b="16" />
  <color r="0" g="0" b="18" />
  <color r="0" g="0" b="20" />
  <color r="0" g="0" b="22" />
  <color r="0" g="0" b="25" />
  <color r="0" g="0" b="27" />
  <color r="0" g="0" b="29" />
  <color r="0" g="0" b="31" />
  <color r="0" g="0" b="33" />
  <color r="0" g="0" b="35" />
  <color r="0" g="0" b="37" />
  <color r="0" g="0" b="39" />
  <color r="0" g="0" b="41" />
  <color r="0" g="0" b="43" />
  <color r="0" g="0" b="45" />
  <color r="0" g="0" b="47" />
  <color r="0" g="0" b="50" />
  <color r="0" g="0" b="52" />
  <color r="0" g="0" b="54" />
  <color r="0" g="0" b="56" />
  <color r="0" g="0" b="58" />
  <color r="0" g="0" b="60" />
  <color r="0" g="0" b="62" />
  <color r="0" g="0" b="64" />
  <color r="0" g="0" b="66" />
  <color r="0" g="3" b="68" />
  <color r="0" g="6" b="70" />
  <color r="0" g="9" b="72" />
  <color r="0" g="12" b="75" />
  <color r="0" g="15" b="77" />
  <color r="0" g="18" b="79" />
  <color r="0" g="21" b="81" />
  <color r="0" g="25" b="83" />
  <color r="0" g="28" b="85" />
  <color r="0" g="31" b="87" />
  <color r="0" g="34" b="89" />
  <color r="0" g="37" b="91" />
  <color r="0" g="40" b="93" />
  <color r="0" g="43" b="95" />
  <color r="0" g="46" b="97" />
  <color r="0" g="50" b="100" />
  <color r="0" g="53" b="100" />
  <color r="0" g="56" b="100" />
  <color r="0" g="59" b="100" />
  <color r="0" g="62" b="100" />
  <color r="0" g="65" b="100" />
  <color r="0" g="68" b="100" />
  <color r="0" g="71" b="100" />
  <color r="0" g="75" b="100" />
  <color r="0" g="78" b="100" />
  <color r="0" g="81" b="100" />
  <color r="0" g="84" b="100" />
  <color r="0" g="87" b="100" />
  <color r="0" g="90" b="100" />
  <color r="0" g="93" b="100" />
  <color r="0" g="96" b="100" />
  <color r="0" g="100" b="100" />
  <color r="0" g="103" b="100" />
  <color r="0" g="106" b="100" />
  <color r="0" g="109" b="100" />
  <color r="0" g="112" b="100" />
  <color r="0" g="115" b="100" />
  <color r="0" g="118" b="100" />
  <color r="0" g="121" b="100" />
  <color r="0" g="125" b="100" />
  <color r="0" g="128" b="100" />
  <color r="0" g="131" b="100" />
  <color r="0" g="134" b="100" />
  <color r="0" g="137" b="100" />
  <color r="0" g="140" b="100" />
  <color r="0" g="143" b="100" />
  <color r="0" g="146" b="100" />
  <color r="0" g="150" b="100" />
  <color r="0" g="150" b="96" />
  <color r="0" g="150" b="93" />
  <color r="0" g="150" b="90" />
  <color r="0" g="150" b="87" />
  <color r="0" g="150" b="84" />
  <color r="0" g="150" b="81" />
  <color r="0" g="150" b="78" />
  <color r="0" g="150" b="75" />
  <color r="0" g="150" b="71" />
  <color r="0" g="150" b="68" />
  <color r="0" g="150" b="65" />
  <color r="0" g="150" b="62" />
  <color r="0" g="150" b="59" />
  <color r="0" g="150" b="56" />
  <color r="0" g="150" b="53" />
  <color r="0" g="150" b="50" />
  <color r="0" g="149" b="46" />
  <color r="0" g="148" b="43" />
  <color r="0" g="148" b="40" />
  <color r="0" g="147" b="37" />
  <color r="0" g="146" b="34" />
  <color r="0" g="146" b="31" />
  <color r="0" g="145" b="28" />
  <color r="0" g="145" b="25" />
  <color r="0" g="144" b="21" />
  <color r="0" g="143" b="18" />
  <color r="0" g="143" b="15" />
  <color r="0" g="142" b="12" />
  <color r="0" g="141" b="9" />
  <color r="0" g="141" b="6" />
  <color r="0" g="140" b="3" />
  <color r="0" g="140" b="0" />
  <color r="7" g="137" b="0" />
  <color r="15" g="135" b="0" />
  <color r="22" g="132" b="0" />
  <color r="30" g="130" b="0" />
  <color r="37" g="127" b="0" />
  <color r="45" g="125" b="0" />
  <color r="52" g="122" b="0" />
  <color r="60" g="120" b="0" />
  <color r="67" g="117" b="0" />
  <color r="75" g="115" b="0" />
  <color r="82" g="112" b="0" />
  <color r="90" g="110" b="0" />
  <color r="97" g="107" b="0" />
  <color r="105" g="105" b="0" />
  <color r="112" g="102" b="0" />
  <color r="120" g="100" b="0" />
  <color r="125" g="93" b="0" />
  <color r="130" g="87" b="0" />
  <color r="135" g="81" b="0" />
  <color r="140" g="75" b="0" />
  <color r="145" g="68" b="0" />
  <color r="150" g="62" b="0" />
  <color r="155" g="56" b="0" />
  <color r="160" g="50" b="0" />
  <color r="165" g="43" b="0" />
  <color r="170" g="37" b="0" />
  <color r="175" g="31" b="0" />
  <color r="180" g="25" b="0" />
  <color r="185" g="18" b="0" />
  <color r="190" g="12" b="0" />
  <color r="195" g="6" b="0" />
  <color r="200" g="0" b="0" />
  <color r="200" g="2" b="0" />
  <color r="201" g="4" b="0" />
  <color r="201" g="6" b="0" />
  <color r="202" g="9" b="0" />
  <color r="202" g="11" b="0" />
  <color r="203" g="13" b="0" />
  <color r="203" g="16" b="0" />
  <color r="204" g="18" b="0" />
  <color r="204" g="20" b="0" />
  <color r="205" g="23" b="0" />
  <color r="205" g="25" b="0" />
  <color r="206" g="27" b="0" />
  <color r="206" g="29" b="0" />
  <color r="207" g="32" b="0" />
  <color r="207" g="34" b="0" />
  <color r="208" g="36" b="0" />
  <color r="208" g="39" b="0" />
  <color r="209" g="41" b="0" />
  <color r="209" g="43" b="0" />
  <color r="210" g="46" b="0" />
  <color r="210" g="48" b="0" />
  <color r="211" g="50" b="0" />
  <color r="211" g="53" b="0" />
  <color r="212" g="55" b="0" />
  <color r="212" g="57" b="0" />
  <color r="213" g="59" b="0" />
  <color r="213" g="62" b="0" />
  <color r="214" g="64" b="0" />
  <color r="214" g="66" b="0" />
  <color r="215" g="69" b="0" />
  <color r="215" g="71" b="0" />
  <color r="216" g="73" b="0" />
  <color r="216" g="76" b="0" />
  <color r="217" g="78" b="0" />
  <color r="217" g="80" b="0" />
  <color r="218" g="83" b="0" />
  <color r="218" g="85" b="0" />
  <color r="219" g="87" b="0" />
  <color r="219" g="89" b="0" />
  <color r="220" g="92" b="0" />
  <color r="220" g="94" b="0" />
  <color r="221" g="96" b="0" />
  <color r="221" g="99" b="0" />
  <color r="222" g="101" b="0" />
  <color r="222" g="103" b="0" />
  <color r="223" g="106" b="0" />
  <color r="223" g="108" b="0" />
  <color r="224" g="110" b="0" />
  <color r="224" g="113" b="0" />
  <color r="225" g="115" b="0" />
  <color r="225" g="117" b="0" />
  <color r="226" g="119" b="0" />
  <color r="226" g="122" b="0" />
  <color r="227" g="124" b="0" />
  <color r="227" g="126" b="0" />
  <color r="228" g="129" b="0" />
  <color r="228" g="131" b="0" />
  <color r="229" g="133" b="0" />
  <color r="229" g="136" b="0" />
  <color r="230" g="138" b="0" />
  <color r="230" g="140" b="0" />
  <color r="231" g="142" b="0" />
  <color r="231" g="145" b="0" />
  <color r="232" g="147" b="0" />
  <color r="232" g="149" b="0" />
  <color r="233" g="152" b="0" />
  <color r="233" g="154" b="0" />
  <color r="234" g="156" b="0" />
  <color r="234" g="159" b="0" />
  <color r="235" g="161" b="0" />
  <color r="235" g="163" b="0" />
  <color r="236" g="166" b="0" />
  <color r="236" g="168" b="0" />
  <color r="237" g="170" b="0" />
  <color r="237" g="172" b="0" />
  <color r="238" g="175" b="0" />
  <color r="238" g="177" b="0" />
  <color r="239" g="179" b="0" />
  <color r="239" g="182" b="0" />
  <color r="240" g="184" b="0" />
  <color r="240" g="186" b="0" />
  <color r="241" g="189" b="0" />
  <color r="241" g="191" b="0" />
  <color r="242" g="193" b="0" />
  <color r="242" g="196" b="0" />
  <color r="243" g="198" b="0" />
  <color r="243" g="200" b="0" />
  <color r="244" g="202" b="0" />
  <color r="244" g="205" b="0" />
  <color r="245" g="207" b="0" />
  <color r="245" g="209" b="0" />
  <color r="246" g="212" b="0" />
  <color r="246" g="214" b="0" />
  <color r="247" g="216" b="0" />
  <color r="247" g="219" b="0" />
  <color r="248" g="221" b="0" />
  <color r="248" g="223" b="0" />
  <color r="249" g="226" b="0" />
  <color r="249" g="228" b="0" />
  <color r="250" g="230" b="0" />
  <color r="250" g="232" b="0" />
  <color r="251" g="235" b="0" />
  <color r="251" g="237" b="0" />
  <color r="252" g="239" b="0" />
  <color r="252" g="242" b="0" />
  <color r="253" g="244" b="0" />
  <color r="253" g="246" b="0" />
  <color r="254" g="249" b="0" />
  <color r="254" g="251" b="0" />
  <color r="255" g="253" b="0" />
  <color r="255" g="255" b="0" />
</palette>
