<?xml version="1.0" encoding="ISO-8859-1"?>
<!DOCTYPE palette SYSTEM "http://coastwatch.noaa.gov/xml/palette.dtd">

<palette name="HSB-Cycle" length="256">
  <color r="255" g="0" b="0" />
  <color r="255" g="6" b="0" />
  <color r="255" g="12" b="0" />
  <color r="255" g="18" b="0" />
  <color r="255" g="24" b="0" />
  <color r="255" g="30" b="0" />
  <color r="255" g="36" b="0" />
  <color r="255" g="42" b="0" />
  <color r="255" g="48" b="0" />
  <color r="255" g="54" b="0" />
  <color r="255" g="60" b="0" />
  <color r="255" g="66" b="0" />
  <color r="255" g="72" b="0" />
  <color r="255" g="78" b="0" />
  <color r="255" g="84" b="0" />
  <color r="255" g="90" b="0" />
  <color r="255" g="96" b="0" />
  <color r="255" g="102" b="0" />
  <color r="255" g="108" b="0" />
  <color r="255" g="114" b="0" />
  <color r="255" g="120" b="0" />
  <color r="255" g="126" b="0" />
  <color r="255" g="132" b="0" />
  <color r="255" g="138" b="0" />
  <color r="255" g="144" b="0" />
  <color r="255" g="150" b="0" />
  <color r="255" g="156" b="0" />
  <color r="255" g="162" b="0" />
  <color r="255" g="168" b="0" />
  <color r="255" g="174" b="0" />
  <color r="255" g="180" b="0" />
  <color r="255" g="186" b="0" />
  <color r="255" g="192" b="0" />
  <color r="255" g="198" b="0" />
  <color r="255" g="204" b="0" />
  <color r="255" g="210" b="0" />
  <color r="255" g="216" b="0" />
  <color r="255" g="222" b="0" />
  <color r="255" g="228" b="0" />
  <color r="255" g="234" b="0" />
  <color r="255" g="240" b="0" />
  <color r="255" g="246" b="0" />
  <color r="255" g="252" b="0" />
  <color r="252" g="255" b="0" />
  <color r="246" g="255" b="0" />
  <color r="240" g="255" b="0" />
  <color r="234" g="255" b="0" />
  <color r="228" g="255" b="0" />
  <color r="222" g="255" b="0" />
  <color r="216" g="255" b="0" />
  <color r="210" g="255" b="0" />
  <color r="204" g="255" b="0" />
  <color r="198" g="255" b="0" />
  <color r="192" g="255" b="0" />
  <color r="186" g="255" b="0" />
  <color r="180" g="255" b="0" />
  <color r="174" g="255" b="0" />
  <color r="168" g="255" b="0" />
  <color r="162" g="255" b="0" />
  <color r="156" g="255" b="0" />
  <color r="150" g="255" b="0" />
  <color r="144" g="255" b="0" />
  <color r="138" g="255" b="0" />
  <color r="132" g="255" b="0" />
  <color r="126" g="255" b="0" />
  <color r="120" g="255" b="0" />
  <color r="114" g="255" b="0" />
  <color r="108" g="255" b="0" />
  <color r="102" g="255" b="0" />
  <color r="96" g="255" b="0" />
  <color r="90" g="255" b="0" />
  <color r="84" g="255" b="0" />
  <color r="78" g="255" b="0" />
  <color r="72" g="255" b="0" />
  <color r="66" g="255" b="0" />
  <color r="60" g="255" b="0" />
  <color r="54" g="255" b="0" />
  <color r="48" g="255" b="0" />
  <color r="42" g="255" b="0" />
  <color r="36" g="255" b="0" />
  <color r="30" g="255" b="0" />
  <color r="24" g="255" b="0" />
  <color r="18" g="255" b="0" />
  <color r="12" g="255" b="0" />
  <color r="6" g="255" b="0" />
  <color r="0" g="255" b="0" />
  <color r="0" g="255" b="6" />
  <color r="0" g="255" b="12" />
  <color r="0" g="255" b="18" />
  <color r="0" g="255" b="24" />
  <color r="0" g="255" b="30" />
  <color r="0" g="255" b="36" />
  <color r="0" g="255" b="42" />
  <color r="0" g="255" b="48" />
  <color r="0" g="255" b="54" />
  <color r="0" g="255" b="60" />
  <color r="0" g="255" b="66" />
  <color r="0" g="255" b="72" />
  <color r="0" g="255" b="78" />
  <color r="0" g="255" b="84" />
  <color r="0" g="255" b="90" />
  <color r="0" g="255" b="96" />
  <color r="0" g="255" b="102" />
  <color r="0" g="255" b="108" />
  <color r="0" g="255" b="114" />
  <color r="0" g="255" b="120" />
  <color r="0" g="255" b="126" />
  <color r="0" g="255" b="132" />
  <color r="0" g="255" b="138" />
  <color r="0" g="255" b="144" />
  <color r="0" g="255" b="150" />
  <color r="0" g="255" b="156" />
  <color r="0" g="255" b="162" />
  <color r="0" g="255" b="168" />
  <color r="0" g="255" b="174" />
  <color r="0" g="255" b="180" />
  <color r="0" g="255" b="186" />
  <color r="0" g="255" b="192" />
  <color r="0" g="255" b="198" />
  <color r="0" g="255" b="204" />
  <color r="0" g="255" b="210" />
  <color r="0" g="255" b="216" />
  <color r="0" g="255" b="222" />
  <color r="0" g="255" b="228" />
  <color r="0" g="255" b="234" />
  <color r="0" g="255" b="240" />
  <color r="0" g="255" b="246" />
  <color r="0" g="255" b="252" />
  <color r="0" g="252" b="255" />
  <color r="0" g="246" b="255" />
  <color r="0" g="240" b="255" />
  <color r="0" g="234" b="255" />
  <color r="0" g="228" b="255" />
  <color r="0" g="222" b="255" />
  <color r="0" g="216" b="255" />
  <color r="0" g="210" b="255" />
  <color r="0" g="204" b="255" />
  <color r="0" g="198" b="255" />
  <color r="0" g="192" b="255" />
  <color r="0" g="186" b="255" />
  <color r="0" g="180" b="255" />
  <color r="0" g="174" b="255" />
  <color r="0" g="168" b="255" />
  <color r="0" g="162" b="255" />
  <color r="0" g="156" b="255" />
  <color r="0" g="150" b="255" />
  <color r="0" g="144" b="255" />
  <color r="0" g="138" b="255" />
  <color r="0" g="132" b="255" />
  <color r="0" g="126" b="255" />
  <color r="0" g="120" b="255" />
  <color r="0" g="114" b="255" />
  <color r="0" g="108" b="255" />
  <color r="0" g="102" b="255" />
  <color r="0" g="96" b="255" />
  <color r="0" g="90" b="255" />
  <color r="0" g="84" b="255" />
  <color r="0" g="78" b="255" />
  <color r="0" g="72" b="255" />
  <color r="0" g="66" b="255" />
  <color r="0" g="60" b="255" />
  <color r="0" g="54" b="255" />
  <color r="0" g="48" b="255" />
  <color r="0" g="42" b="255" />
  <color r="0" g="36" b="255" />
  <color r="0" g="30" b="255" />
  <color r="0" g="24" b="255" />
  <color r="0" g="18" b="255" />
  <color r="0" g="12" b="255" />
  <color r="0" g="6" b="255" />
  <color r="0" g="0" b="255" />
  <color r="6" g="0" b="255" />
  <color r="12" g="0" b="255" />
  <color r="18" g="0" b="255" />
  <color r="24" g="0" b="255" />
  <color r="30" g="0" b="255" />
  <color r="36" g="0" b="255" />
  <color r="42" g="0" b="255" />
  <color r="48" g="0" b="255" />
  <color r="54" g="0" b="255" />
  <color r="60" g="0" b="255" />
  <color r="66" g="0" b="255" />
  <color r="72" g="0" b="255" />
  <color r="78" g="0" b="255" />
  <color r="84" g="0" b="255" />
  <color r="90" g="0" b="255" />
  <color r="96" g="0" b="255" />
  <color r="102" g="0" b="255" />
  <color r="108" g="0" b="255" />
  <color r="114" g="0" b="255" />
  <color r="120" g="0" b="255" />
  <color r="126" g="0" b="255" />
  <color r="132" g="0" b="255" />
  <color r="138" g="0" b="255" />
  <color r="144" g="0" b="255" />
  <color r="150" g="0" b="255" />
  <color r="156" g="0" b="255" />
  <color r="162" g="0" b="255" />
  <color r="168" g="0" b="255" />
  <color r="174" g="0" b="255" />
  <color r="180" g="0" b="255" />
  <color r="186" g="0" b="255" />
  <color r="192" g="0" b="255" />
  <color r="198" g="0" b="255" />
  <color r="204" g="0" b="255" />
  <color r="210" g="0" b="255" />
  <color r="216" g="0" b="255" />
  <color r="222" g="0" b="255" />
  <color r="228" g="0" b="255" />
  <color r="234" g="0" b="255" />
  <color r="240" g="0" b="255" />
  <color r="246" g="0" b="255" />
  <color r="252" g="0" b="255" />
  <color r="255" g="0" b="252" />
  <color r="255" g="0" b="246" />
  <color r="255" g="0" b="240" />
  <color r="255" g="0" b="234" />
  <color r="255" g="0" b="228" />
  <color r="255" g="0" b="222" />
  <color r="255" g="0" b="216" />
  <color r="255" g="0" b="210" />
  <color r="255" g="0" b="204" />
  <color r="255" g="0" b="198" />
  <color r="255" g="0" b="192" />
  <color r="255" g="0" b="186" />
  <color r="255" g="0" b="180" />
  <color r="255" g="0" b="174" />
  <color r="255" g="0" b="168" />
  <color r="255" g="0" b="162" />
  <color r="255" g="0" b="156" />
  <color r="255" g="0" b="150" />
  <color r="255" g="0" b="144" />
  <color r="255" g="0" b="138" />
  <color r="255" g="0" b="132" />
  <color r="255" g="0" b="126" />
  <color r="255" g="0" b="120" />
  <color r="255" g="0" b="114" />
  <color r="255" g="0" b="108" />
  <color r="255" g="0" b="102" />
  <color r="255" g="0" b="96" />
  <color r="255" g="0" b="90" />
  <color r="255" g="0" b="84" />
  <color r="255" g="0" b="78" />
  <color r="255" g="0" b="72" />
  <color r="255" g="0" b="66" />
  <color r="255" g="0" b="60" />
  <color r="255" g="0" b="54" />
  <color r="255" g="0" b="48" />
  <color r="255" g="0" b="42" />
  <color r="255" g="0" b="36" />
  <color r="255" g="0" b="30" />
  <color r="255" g="0" b="24" />
  <color r="255" g="0" b="18" />
  <color r="255" g="0" b="12" />
  <color r="255" g="0" b="6" />
  <color r="255" g="0" b="0" />
</palette>
