<?xml version="1.0" encoding="ISO-8859-1"?>
<!DOCTYPE palette SYSTEM "http://coastwatch.noaa.gov/xml/palette.dtd">
<palette name="Coral-Reef-Degree-Heating-Week" length="20">

<!-- Less than 0 -->
<!-- <color r="200" g="250" b="250" /> -->

<!-- 0 to 4 -->
<color r="70" g="50" b="120" />
<color r="100" g="80" b="150" />
<color r="130" g="110" b="180" />
<color r="160" g="140" b="210" />

<!-- 4 to 8 -->
<color r="255" g="255" b="0" />
<color r="255" g="220" b="0" />
<color r="255" g="185" b="0" />
<color r="255" g="150" b="0" />

<!-- 8 to 12 -->
<color r="255" g="0" b="0" />
<color r="210" g="0" b="0" />
<color r="160" g="0" b="0" />
<color r="110" g="0" b="0" />

<!-- 12 to 16 -->
<color r="230" g="125" b="70" />
<color r="180" g="90" b="40" />
<color r="125" g="60" b="30" />
<color r="85" g="45" b="20" />

<!-- 16 to 20 -->
<color r="240" g="0" b="240" />
<color r="200" g="0" b="200" />
<color r="160" g="0" b="160" />
<color r="120" g="0" b="120" />

<!-- Greater than 20 -->
<!-- <color r="50" g="0" b="50" /> -->

</palette>
